"title","author","journal","number","cites","year","cid","pubid","url","id","year_num"
"Predation of ladybirds (Coleoptera: Coccinellidae) by wood ants, Formica rufa L.(Hymenoptera: Formicidae).","JJ Sloggett, A Manica, MJ Day, MEN Majerus","Entomologist's Gazette","50 (3), 217-221",22,1999,"5268430084061789311","9ZlFYXVOiuMC","https://www.cabidigitallibrary.org/doi/full/10.5555/19991108956","v8V058QAAAAJ",1999
"Morphological and fluorescence analysis of the Montastraea annularis species complex in Florida","A Manica, RW Carter","Marine Biology","137, 899-906",29,2000,"12945708148212046398","_kc_bZDykSQC","https://link.springer.com/article/10.1007/s002270000422","v8V058QAAAAJ",2000
"Rhythms of activity and foraging in the intertidal insect Anurida maritima: coping with the tide","FK McMeechan, A Manica, WA Foster","Journal of the Marine Biological Association of the United Kingdom","80 (1 …",18,2000,"6206803231529343581","aqlVkmm33-oC","https://www.cambridge.org/core/journals/journal-of-the-marine-biological-association-of-the-united-kingdom/article/rhythms-of-activity-and-foraging-in-the-intertidal-insect-anurida-maritima-coping-with-the-tide/C469DE9C76F0261557A1A2F170607A15","v8V058QAAAAJ",2000
"Orientation in the intertidal salt-marsh collembolan Anurida maritima","A Manica, FK McMeechan, WA Foster","Behavioral Ecology and Sociobiology","47, 371-375",9,2000,"7501146920161527909","-f6ydRqryjwC","https://link.springer.com/article/10.1007/s002650050679","v8V058QAAAAJ",2000
"An aggregation pheromone in the intertidal collembolan Anurida maritima","A Manica, FK McMeechan, WA Foster","Entomologia Experimentalis et Applicata","99 (3), 393-395",22,2001,"3238980400724914620","mVmsd5A6BfQC","https://citeseerx.ist.psu.edu/document?repid=rep1&type=pdf&doi=9d15fdab5cd51421616293bab92ad20e3dd67c6c","v8V058QAAAAJ",2001
"Filial cannibalism in teleost fish","A Manica","Biological Reviews","77 (2), 261-277",296,2002,"12766025298368371282","UeHWp8X0CEIC","https://www.cambridge.org/core/journals/biological-reviews/article/filial-cannibalism-in-teleost-fish/845135A0F66523EA2F5ABE48ED0650A7","v8V058QAAAAJ",2002
"Alternative strategies for a father with a small brood: mate, cannibalise or care","A Manica","Behavioral Ecology and Sociobiology","51, 319-323",59,2002,"3002862333485792720","_FxGoFyzp5QC","https://link.springer.com/article/10.1007/s00265-001-0444-0","v8V058QAAAAJ",2002
"Filial cannibalism in a sergeant damselfish","A Manica","University of Cambridge","",3,2002,"10854781823887765710","ZHo1McVdvXMC","https://scholar.google.com/scholar?cluster=10854781823887765710&hl=en&oi=scholarr","v8V058QAAAAJ",2002
"Filial cannibalism in an assassin bug","LK Thomas, A Manica","Animal Behaviour","66 (2), 205-210",78,2003,"17955726052965230758,16237295850558400911","UebtZRa9Y70C","https://www.sciencedirect.com/science/article/pii/S0003347203922020","v8V058QAAAAJ",2003
"The effect of brood size and age on partial filial cannibalism in the scissortail sergeant","A Manica","Journal of Fish Biology","63 (1), 37-47",29,2003,"5066112814329380225","KlAtU1dfN6UC","https://onlinelibrary.wiley.com/doi/abs/10.1046/j.1095-8649.2003.00113.x","v8V058QAAAAJ",2003
"Parental fish change their cannibalistic behaviour in response to the cost-to-benefit ratio of parental care","A Manica","Animal Behaviour","67 (6), 1015-1021",93,2004,"2067176754583476464","eQOLeE2rZwMC","https://www.sciencedirect.com/science/article/pii/S0003347204000533","v8V058QAAAAJ",2004
"Hollywood, climate change, and the public","A Balmford, A Manica, L Airey, L Birkin, A Oliver, J Schleicher","Science","305 (5691), 1713-1713",76,2004,"2639774301725943990","Zph67rFs4hoC","https://www.science.org/doi/pdf/10.1126/science.305.5691.1713b","v8V058QAAAAJ",2004
"The evolution of paternal care with overlapping broods","A Manica, RA Johnstone","The American Naturalist","164 (4), 517-530",59,2004,"15519072525254800105","8k81kl-MbHgC","https://www.journals.uchicago.edu/doi/abs/10.1086/423792","v8V058QAAAAJ",2004
"Pathogen-driven selection and worldwide HLA class I diversity","F Prugnolle, A Manica, M Charpentier, JF Guégan, V Guernier, F Balloux","Current Biology","15 (11), 1022-1027",558,2005,"3084298826436624707,6460903291711429556","qjMakFHDy7sC","https://www.cell.com/fulltext/S0960-9822(05)00451-3","v8V058QAAAAJ",2005
"Geography predicts neutral genetic diversity of human populations","F Prugnolle, A Manica, F Balloux","Current Biology","15 (5), R159-R160",522,2005,"18086808601789706716,8493784613297339040","9yKSN-GCB0IC","https://www.cell.com/neuron/fulltext/S0960-9822(05)00209-5","v8V058QAAAAJ",2005
"Geography is a better determinant of human genetic differentiation than ethnicity","A Manica, F Prugnolle, F Balloux","Human Genetics","118, 366-371",168,2005,"6363345842864346689","Tyk-4Ss8FVUC","https://link.springer.com/article/10.1007/s00439-005-0039-3","v8V058QAAAAJ",2005
"When should communities and conservationists monitor exploited resources?","NJ Hockley, JPG Jones, FB Andriahajaina, A Manica, EH Ranambitsoa, JA Randriamboahary","Biodiversity & Conservation","14, 2795-2806",76,2005,"10999049477641034221","ufrVoPGSRksC","https://link.springer.com/article/10.1007/s10531-005-8416-8","v8V058QAAAAJ",2005
"Inter-order interactions between flower-visiting insects: foraging bees avoid flowers previously visited by hoverflies","T Reader, I MacLeod, PT Elliott, OJ Robinson, A Manica","Journal of Insect Behavior","18, 51-57",58,2005,"1061218312429493132","3fE2CSJIrl8C","https://www.researchgate.net/profile/Andrea-Manica/publication/226544811_Inter-Order_Interactions_Between_Flower-Visiting_InsectsForaging_Bees_Avoid_Flowers_Previously_Visited_by_Hoverflies/links/02e7e525d2ba64acca000000/Inter-Order-Interactions-Between-Flower-Visiting-Insects-Foraging-Bees-Avoid-Flowers-Previously-Visited-by-Hoverflies.pdf","v8V058QAAAAJ",2005
"Intrasexual competition and mate choice in assassin bugs with uniparental male and female care","LK Thomas, A Manica","Animal Behaviour","69 (2), 275-281",39,2005,"8967903116844359408","ULOm3_A8WrAC","https://www.sciencedirect.com/science/article/pii/S0003347204003112","v8V058QAAAAJ",2005
"Effects of sampling regime on the mean and variance of home range size estimates","L Börger, N Franconi, GD Michele, A Gantz, F Meschi, A Manica, S Lovari, TIM Coulson","Journal of Animal Ecology","1393-1405",889,2006,"2165140927155424666","d1gkVwhDpl0C","https://www.jstor.org/stable/4125081","v8V058QAAAAJ",2006
"A geographically explicit genetic model of worldwide human-settlement history","H Liu, F Prugnolle, A Manica, F Balloux","The American Journal of Human Genetics","79 (2), 230-237",477,2006,"5953928764862665459","u-x6o8ySG0sC","https://www.cell.com/ajhg/fulltext/S0002-9297(07)63131-0","v8V058QAAAAJ",2006
"Keeping bandits at bay?","H Scales, A Balmford, M Liu, Y Sadovy, A Manica","Science","313 (5787), 612-614",65,2006,"9131237930618571889","roLk4NBRz8UC","https://www.science.org/doi/pdf/10.1126/science.313.5787.612c","v8V058QAAAAJ",2006
"Adaptive preferential selection of female coccinellid hosts by the parasitoid wasp Dinocampus coccinellae (Hymenoptera: Braconidae)","DS Davis, SL Stewart, A Manica, MEN Majerus","European Journal of Entomology","103 (1), 41",32,2006,"1376014037994165737","mB3voiENLucC","https://www.researchgate.net/profile/Andrea-Manica/publication/280808342_Adaptive_preferential_selection_of_female_coccinellid_hosts_by_the_parasitoid_wasp_Dinocampus_coccinellae_Hymenoptera_Braconidae/links/5ab451ab0f7e9b4897c7a155/Adaptive-preferential-selection-of-female-coccinellid-hosts-by-the-parasitoid-wasp-Dinocampus-coccinellae-Hymenoptera-Braconidae.pdf?origin=journalDetail&_tp=eyJwYWdlIjoiam91cm5hbERldGFpbCJ9","v8V058QAAAAJ",2006
"Genome-wide characterisation of hepatitis B mutations involved in clinical outcome","C Szmaragd, GR Foster, A Manica, A Bartholomeusz, RA Nichols, F Balloux","Heredity","97 (6), 389-397",23,2006,"18282235642042846304","QIV2ME_5wuYC","https://www.nature.com/articles/6800882","v8V058QAAAAJ",2006
"The effects of castration, sex ratio and population density on social segregation and habitat use in Soay sheep","KE Ruckstuhl, A Manica, ADC MacColl, JG Pilkington, TH Clutton-Brock","Behavioral Ecology and Sociobiology","59, 694-703",23,2006,"1756783381188865079","Wp0gIr-vW9MC","https://link.springer.com/article/10.1007/s00265-005-0099-3","v8V058QAAAAJ",2006
"Global genetic positioning: evidence for early human population centers in coastal habitats","W Amos, A Manica","Proceedings of the National Academy of Sciences","103 (3), 820-824",23,2006,"5241409579560619027","qxL8FJ1GzNcC","https://www.pnas.org/doi/abs/10.1073/pnas.0507991103","v8V058QAAAAJ",2006
"The optimal balance of defence investment strategies in clonal colonies of social aphids","N Pike, A Manica","Behavioral Ecology and Sociobiology","60, 803-814",10,2006,"6237876046185782680","L8Ckcad2t8MC","https://link.springer.com/article/10.1007/s00265-006-0224-y","v8V058QAAAAJ",2006
"Diurnal versus nocturnal pollination of Brunsvigia gregaria RA Dyer (Amaryllidaceae) at a coastal site","B Balmford, J Balmford, A Balmford, S Blakeman, A Manica, RM Cowling","South African Journal of Botany","72 (2), 291-294",8,2006,"11993836022217037669","k_IJM867U9cC","https://www.sciencedirect.com/science/article/pii/S0254629905000438","v8V058QAAAAJ",2006
"The basis of cowardice in social defenders","N Pike, A Manica","Ecological Modelling","196 (3-4), 275-282",5,2006,"12625128045785829145","r0BpntZqJG4C","https://www.sciencedirect.com/science/article/pii/S0304380006001128","v8V058QAAAAJ",2006
"Non-random mating in the beetle Cryptocephalus hypochaeridis","C O Luanaigh, TZ Ang, A Manica, SA Rands","Bulletin of Insectology","59 (1), 11",4,2006,"15294548169269661582","iH-uZ7U-co4C","https://citeseerx.ist.psu.edu/document?repid=rep1&type=pdf&doi=680647342a9df13cdaf2c061688554d0e67d80f6","v8V058QAAAAJ",2006
"400 Hepatitis B virus mutations involved in clinical outcome","C Szmaragd, GR Foster, A Manica, A Bartholomeusz, RA Nichols, F Balloux","Journal of Hepatology, S","S151",0,2006,NA,"YFjsv_pBGBYC","https://www.infona.pl/resource/bwmeta1.element.elsevier-93bb0ec6-dae0-3b6c-b698-511415f3cce0","v8V058QAAAAJ",2006
"An African origin for the intimate association between humans and Helicobacter pylori","B Linz, Fço Balloux, Y Moodley, A Manica, H Liu, P Roumagnac, D Falush, C Stamer, F Prugnolle, SWvd Merwe, Y Yamaoka, DY Graham, E Perez-Trallero, T Wadstrom, S Suerbaum, M Achtman","Nature","445 (7130), 915-918",1255,2007,"12448575607386633050,17455131320080180615,11248483500462577635","u5HHmVD_uO8C","https://www.nature.com/articles/nature05562","v8V058QAAAAJ",2007
"Business-to-business adoption of eCommerce in China","J Tan, K Tyler, A Manica","Information & management","44 (3), 332-351",491,2007,"809465028156454583","zYLM7Y9cAGgC","https://www.sciencedirect.com/science/article/pii/S0378720607000298","v8V058QAAAAJ",2007
"The effect of ancient population bottlenecks on human phenotypic variation","A Manica, W Amos, F Balloux, T Hanihara","Nature","448 (7151), 346-348",448,2007,"683039785353276025","2osOgNQ5qMEC","https://www.nature.com/articles/nature05951","v8V058QAAAAJ",2007
"Going the distance: human population genetics in a clinal world","LJL Handley, A Manica, J Goudet, F Balloux","Trends in Genetics","23 (9), 432-439",309,2007,"10980751038560752552,5193662358908719932","IjCSPb-OGe4C","https://www.cell.com/trends/genetics/fulltext/S0168-9525(07)00232-6","v8V058QAAAAJ",2007
"Message received? Quantifying the impact of informal conservation education on adults visiting UK zoos","A Balmford, N Leader-Williams, GM Mace, A Manica, O Walter, C West, A Zimmermann","Cambridge University Press","",95,2007,"11937734389021545425","g5m5HwL7SMYC","https://kar.kent.ac.uk/2832","v8V058QAAAAJ",2007
"Impacts of the live reef fish trade on populations of coral reef fish off northern Borneo","H Scales, A Balmford, A Manica","Proceedings of the Royal Society B: Biological Sciences","274 (1612), 989-994",48,2007,"15406226975209467237","4DMP91E08xMC","https://royalsocietypublishing.org/doi/abs/10.1098/rspb.2006.0280","v8V058QAAAAJ",2007
"Measuring conservation success: assessing zoos' contribution.","GM Mace, A Balmford, N Leader-Williams, A Manica, O Walter, C West, A Zimmermann","","",40,2007,"5920290439891873878","LI9QrySNdTsC","https://www.cabidigitallibrary.org/doi/full/10.5555/20093032090","v8V058QAAAAJ",2007
"Shoaling preferences in decapod crustacea","SR Evans, M Finnie, A Manica","Animal Behaviour","74 (6), 1691-1696",31,2007,"12852716396851412836","RHpTSmoSYBkC","https://www.sciencedirect.com/science/article/pii/S0003347207003338","v8V058QAAAAJ",2007
"Monitoring the live reef food fish trade: Lessons learned from local and global perspectives","H Scales, A Balmford, A Manica","SPC Live Reef Fish Information Bulletin","17, 36-44",10,2007,"18313855062177531453","TFP_iSt0sucC","https://citeseerx.ist.psu.edu/document?repid=rep1&type=pdf&doi=cbf42938b19c66e4661ca05e8ce85d063491e854#page=36","v8V058QAAAAJ",2007
"2007, Proceedings, Biological Sciences/The Royal Society: Impacts of the live reef fish trade on populations of coral reef fish off northern Borneo.","H Scales, A Balmford, A Manica","Borneo Research Bulletin","38, 266-267",0,2007,NA,"u-coK7KVo8oC","https://go.gale.com/ps/i.do?id=GALE%7CA179660449&sid=googleScholar&v=2.1&it=r&linkaccess=abs&issn=00067806&p=AONE&sw=w","v8V058QAAAAJ",2007
"SME's adoption of B2B eCommerce in the North, South and West of China","K Tyler, A Manica, J Tan, L Zhao, J Lynch","Academy of Marketing Conference (AM","M2007)",0,2007,NA,"O3NaXMp0MMsC","https://westminsterresearch.westminster.ac.uk/item/9208q/sme-s-adoption-of-b2b-ecommerce-in-the-north-south-and-west-of-china","v8V058QAAAAJ",2007
"Horizontal versus familial transmission of Helicobacter pylori","S Schwarz, G Morelli, B Kusecek, A Manica, F Balloux, RJ Owen, DY Graham, Svd Merwe, M Achtman, S Suerbaum","PLoS Pathogens","4 (10), e1000180",233,2008,"1824813867682342357","W7OEmFMy1HYC","https://journals.plos.org/plospathogens/article?id=10.1371/journal.ppat.1000180","v8V058QAAAAJ",2008
"Calibrating conservation: new tools for measuring success","V Kapos, A Balmford, R Aveling, P Bubb, P Carey, A Entwistle, J Hopkins, T Mulliken, R Safford, A Stattersfield, M Walpole, A Manica","Conservation Letters","1 (4), 155-164",233,2008,"8900558162017483997","WF5omc3nYNoC","https://conbio.onlinelibrary.wiley.com/doi/abs/10.1111/j.1755-263X.2008.00025.x","v8V058QAAAAJ",2008
"Determinants of reproductive success in dominant female meerkats","SJ Hodge, A Manica, TP Flower, TH Clutton-Brock","Journal of Animal Ecology","92-102",160,2008,"9499416281183541721","MXK_kJrjxJIC","https://www.jstor.org/stable/20143162","v8V058QAAAAJ",2008
"Quantifying the costs and benefits of protective egg coating in a Chrysomelid beetle","TZ Ang, C O’luanaigh, SA Rands, A Balmford, A Manica","Ecological Entomology","33 (4), 484-487",12,2008,"16042115417990987294,15947187745122455728","blknAaTinKkC","https://resjournals.onlinelibrary.wiley.com/doi/abs/10.1111/j.1365-2311.2008.00999.x","v8V058QAAAAJ",2008
"A zoologist traces flu across the globe","A Manica","Nature","453 (7194), 431-432",0,2008,NA,"HbR8gkJAVGIC","https://go.gale.com/ps/i.do?id=GALE%7CA183424136&sid=googleScholar&v=2.1&it=r&linkaccess=abs&issn=00280836&p=HRCA&sw=w","v8V058QAAAAJ",2008
"Observation du commerce de poissons de récifs vivant: Leçons tirées des expériences locales et mondiales","H Scales, A Balmford, A Manica","","",0,2008,NA,"NaGl4SEjCO4C","http://coastfish.spc.int/News/MRC/17/LRF17VF_36_Scales.pdf","v8V058QAAAAJ",2008
"A global perspective on trends in nature-based tourism","A Balmford, J Beresford, J Green, R Naidoo, M Walpole, A Manica","PLoS Biology","7 (6), e1000144",918,2009,"5756596507699624422","YsMSGLbcyi4C","https://journals.plos.org/plosbiology/article?id=10.1371/journal.pbio.1000144","v8V058QAAAAJ",2009
"Social feedback and the emergence of leaders and followers","JL Harcourt, TZ Ang, G Sweetman, RA Johnstone, A Manica","Current Biology","19 (3), 248-252",332,2009,"15376933455262027025","Y0pCki6q_DkC","https://www.cell.com/current-biology/fulltext/S0960-9822(09)00554-5","v8V058QAAAAJ",2009
"Distance from Africa, not climate, explains within-population phenotypic diversity in humans","L Betti, F Balloux, W Amos, T Hanihara, A Manica","Proceedings of the Royal Society B: Biological Sciences","276 (1658), 809-814",235,2009,"12359279130893401222","LkGwnXOMwfcC","https://royalsocietypublishing.org/doi/abs/10.1098/rspb.2008.1563","v8V058QAAAAJ",2009
"Climate shaped the worldwide distribution of human mitochondrial DNA sequence variation","F Balloux, LJL Handley, T Jombart, H Liu, A Manica","Proceedings of the Royal Society B: Biological Sciences","276 (1672), 3447-3455",186,2009,"2282674016560391220,8954347015333748646","Se3iqnhoufwC","https://royalsocietypublishing.org/doi/abs/10.1098/rspb.2009.0752","v8V058QAAAAJ",2009
"Stochastic and deterministic processes jointly structure tropical arthropod communities","MD Farnon Ellwood, A Manica, WA Foster","Ecology Letters","12 (4), 277-284",176,2009,"614852913312538143","hqOjcs7Dif8C","https://onlinelibrary.wiley.com/doi/abs/10.1111/j.1461-0248.2009.01284.x","v8V058QAAAAJ",2009
"Outcomes, not implementation, predict conservation success","V Kapos, A Balmford, R Aveling, P Bubb, P Carey, A Entwistle, J Hopkins, T Mulliken, R Safford, A Stattersfield, M Walpole, A Manica","Oryx","43 (3), 336-342",151,2009,"12896932259175743807","YOwf2qJgpHMC","https://www.cambridge.org/core/journals/oryx/article/outcomes-not-implementation-predict-conservation-success/0513F0183963C075F8B85DE1A59EE559","v8V058QAAAAJ",2009
"Personality counts: the effect of boldness on shoal choice in three-spined sticklebacks","JL Harcourt, G Sweetman, RA Johnstone, A Manica","Animal Behaviour","77 (6), 1501-1505",138,2009,"14480835566299473892","0EnyYjriUFMC","https://www.sciencedirect.com/science/article/pii/S0003347209001262","v8V058QAAAAJ",2009
"Evidence for a depth refuge effect in artisanal coral reef fisheries","EHM Tyler, MR Speight, P Henderson, A Manica","Biological Conservation","142 (3), 652-667",73,2009,"3039270761863252433","M3ejUd6NZC8C","https://www.sciencedirect.com/science/article/pii/S0006320708004552","v8V058QAAAAJ",2009
"Capturing the many dimensions of threat: comment on Salafsky et al.","A Balmford, P Carey, V Kapos, A Manica, ASL Rodrigues, JörPW Scharlemann, RE Green","Conservation Biology","23 (2), 482-487",72,2009,"6658771363523281485","ZeXyd9-uunAC","https://www.jstor.org/stable/29738749","v8V058QAAAAJ",2009
"How accurate is the current picture of human genetic variation?","IG Romero, A Manica, J Goudet, LL Handley, F Balloux","Heredity","102 (2), 120-126",51,2009,"13768722854392648949","5nxA0vEk-isC","https://www.nature.com/articles/hdy200889","v8V058QAAAAJ",2009
"Leadership, personality and social feedback","JL Harcourt, TZ Ang, G Sweetman, RA Johnstone, A Manica","Communicative & Integrative Biology","2 (4), 335-336",10,2009,"16753650833166413006","RYcK_YlVTxYC","https://www.tandfonline.com/doi/abs/10.4161/cib.2.4.8471","v8V058QAAAAJ",2009
"Brood conspicuousness and clutch viability in male‐caring assassin bugs (Rhinocoris tristis)","J Gilbert, A Manica","Ecological Entomology","34 (2), 176-182",10,2009,"6896645836391491263","hC7cP41nSMkC","https://resjournals.onlinelibrary.wiley.com/doi/abs/10.1111/j.1365-2311.2008.01057.x","v8V058QAAAAJ",2009
"Ancient demography, not climate, explains within-population phenotypic diversity, in humans","A Manica, L Betti, F Balloux, W Amos, T Hanihara","American Journal of Physicsl Anthropology","182-182",0,2009,NA,"70eg2SAEIzsC","https://scholar.google.com/scholar?cluster=9373978143208610355&hl=en&oi=scholarr","v8V058QAAAAJ",2009
"The relative role of drift and selection in shaping the human skull","L Betti, F Balloux, T Hanihara, A Manica","American Journal of Physical Anthropology","141 (1), 76-82",177,2010,"11064376532227476051","kNdYIx-mwKoC","https://onlinelibrary.wiley.com/doi/abs/10.1002/ajpa.21115","v8V058QAAAAJ",2010
"Plasmodium falciparum accompanied the human expansion out of Africa","K Tanabe, T Mita, T Jombart, A Eriksson, S Horibe, N Palacpac, L Ranford-Cartwright, H Sawai, N Sakihama, H Ohmae, M Nakamura, MU Ferreira, AA Escalante, F Prugnolle, A Björkman, A Färnert, A Kaneko, T Horii, A Manica, H Kishino, F Balloux","Current Biology","20 (14), 1283-1289",151,2010,"12337876853354179775,10124376971847912535","ldfaerwXgEUC","https://www.cell.com/current-biology/fulltext/S0960-9822(10)00657-3","v8V058QAAAAJ",2010
"Distribution and use of income from bushmeat in a rural village, central Gabon","L Coad, K Abernethy, A Balmford, A Manica, L Airey, EJ MILNER‐GULLAND","Conservation Biology","24 (6), 1510-1518",129,2010,"4832518865064328916","TQgYirikUcIC","https://conbio.onlinelibrary.wiley.com/doi/abs/10.1111/j.1523-1739.2010.01525.x","v8V058QAAAAJ",2010
"Parental care trade-offs and life-history relationships in insects","JDJ Gilbert, A Manica","The American Naturalist","176 (2), 212-226",88,2010,"17205120947790177101","bEWYMUwI8FkC","https://www.journals.uchicago.edu/doi/abs/10.1086/653661","v8V058QAAAAJ",2010
"A global assessment of amphibian taxonomic effort and expertise","ASL Rodrigues, CL Gray, BJ Crowter, RM Ewers, SN Stuart, T Whitten, A Manica","BioScience","60 (10), 798-806",74,2010,"4155265255169144380","4JMBOYKVnBMC","https://academic.oup.com/bioscience/article-abstract/60/10/798/231551","v8V058QAAAAJ",2010
"Aggression, segregation and stability in a dominance hierarchy","TZ Ang, A Manica","Proceedings of the Royal Society B: Biological Sciences","277 (1686), 1337-1343",70,2010,"15588668943502642357","7PzlFSSx8tAC","https://royalsocietypublishing.org/doi/abs/10.1098/rspb.2009.1839","v8V058QAAAAJ",2010
"Commercializing bycatch can push a fishery beyond economic extinction","AS Lobo, A Balmford, R Arthur, A Manica","Conservation Letters","3 (4), 277-285",61,2010,"12067047346331980049","maZDTaKrznsC","https://conbio.onlinelibrary.wiley.com/doi/abs/10.1111/j.1755-263X.2010.00117.x","v8V058QAAAAJ",2010
"Pairs of fish resolve conflicts over coordinated movement by taking turns","JL Harcourt, G Sweetman, A Manica, RA Johnstone","Current Biology","20 (2), 156-160",61,2010,"2120357852973772476","4TOpqqG69KYC","https://www.cell.com/current-biology/fulltext/S0960-9822(09)02060-0","v8V058QAAAAJ",2010
"Boldness and information use in three‐spined sticklebacks","JL Harcourt, S Biau, R Johnstone, A Manica","Ethology","116 (5), 440-447",58,2010,"7374658614006029806","_Qo2XoVZTnwC","https://onlinelibrary.wiley.com/doi/abs/10.1111/j.1439-0310.2010.01757.x","v8V058QAAAAJ",2010
"Quantifying the benefits and costs of parental care in assassin bugs","JDJ Gilbert, LK Thomas, A Manica","Ecological Entomology","35 (5), 639-651",56,2010,"9640523544967434286","j3f4tGmQtD8C","https://resjournals.onlinelibrary.wiley.com/doi/abs/10.1111/j.1365-2311.2010.01221.x","v8V058QAAAAJ",2010
"Unavoidable limits on group size in a body size-based linear hierarchy","TZ Ang, A Manica","Behavioral Ecology","21 (4), 819-825",49,2010,"18181882535445150874","qUcmZB5y_30C","https://academic.oup.com/beheco/article-abstract/21/4/819/249365","v8V058QAAAAJ",2010
"Reducing over-reporting of deterministic co-occurrence patterns in biotic communities","TM Fayle, A Manica","Ecological Modelling","221 (19), 2237-2242",45,2010,"14627757332114276859","IWHjjKOFINEC","https://www.sciencedirect.com/science/article/pii/S0304380010002826","v8V058QAAAAJ",2010
"The shadow of the future affects cooperation in a cleaner fish","J Oates, A Manica, R Bshary","Current Biology","20 (11), R472-R473",39,2010,"7713707677072922656","dhFuZR0502QC","https://www.cell.com/current-biology/fulltext/S0960-9822(10)00460-4","v8V058QAAAAJ",2010
"Roving and Service Quality in the Cleaner Wrasse Labroides bicolor","J Oates, A Manica, R Bshary","Ethology","116 (4), 309-315",38,2010,"2046160242520527846","HDshCWvjkbEC","https://onlinelibrary.wiley.com/doi/abs/10.1111/j.1439-0310.2010.01742.x","v8V058QAAAAJ",2010
"Benefits and Costs of Dominance in the Angelfish Centropyge bicolor","TZ Ang, A Manica","Ethology","116 (9), 855-865",37,2010,"6876938005286039321","R3hNpaxXUhUC","https://onlinelibrary.wiley.com/doi/abs/10.1111/j.1439-0310.2010.01798.x","v8V058QAAAAJ",2010
"DeﬁningandMeasuring Success in Conservation","V Kapos, RA AndreaManica, P Bubb, P Carey, A Entwistle, J Hopkins, T Mulliken, R Safford, A Stattersﬁeld, MJ Walpole, A Balmford","Trade-offs in Conservation: Deciding what to Save","8, 73",21,2010,"6140756484605953609","5Ul4iDaHHb8C","https://books.google.com/books?hl=en&lr=&id=ju30VGWm1pwC&oi=fnd&pg=PA73&dq=info:SUYd1XxZOFUJ:scholar.google.com&ots=dUmz2WljHu&sig=RIQRUT6aMOnVnBu9EuDOmKDxiE4","v8V058QAAAAJ",2010
"Female scissortail sergeants (Pisces: Pomacentridae) use test eggs to choose good fathers","A Manica","Animal Behaviour","79 (1), 237-242",19,2010,"424611187874285366","hFOr9nPyWt4C","https://www.sciencedirect.com/science/article/pii/S0003347209005090","v8V058QAAAAJ",2010
