"title","author","journal","number","cites","year","cid","pubid","url","id","year_num"
"A genomic history of Aboriginal Australia","A-S Malaspinas, MC Westaway, C Muller, VC Sousa, O Lao, I Alves, A Bergström, G Athanasiadis, JY Cheng, JE Crawford, TH Heupink, E Macholdt, S Peischl, S Rasmussen, S Schiffels, S Subramanian, JL Wright, A Albrechtsen, C Barbieri, I Dupanloup, A Eriksson, A Margaryan, I Moltke, I Pugach, TS Korneliussen, IP Levkivskyi, JVíc Moreno-Mayar, S Ni, F Racimo, M Sikora, Y Xue, FA Aghakhanian, N Brucato, Sør Brunak, PF Campos, W Clark, S Ellingvåg, G Fourmile, P Gerbault, D Injie, G Koki, M Leavesley, B Logan, A Lynch, EA Matisoo-Smith, PJ McAllister, AJ Mentzer, M Metspalu, AB Migliano, L Murgha, ME Phipps, W Pomat, D Reynolds, F-X Ricaut, P Siba, MG Thomas, T Wales, CM’r Wall, SJ Oppenheimer, C Tyler-Smith, R Durbin, J Dortch, A Manica, MH Schierup, RA Foley, MMón Lahr, C Bowern, JD Wall, T Mailund, M Stoneking, R Nielsen, MS Sandhu, L Excoffier, DM Lambert, E Willerslev","Nature","538 (7624), 207-214",641,2016,"1430906051021714197","URolC5Kub84C","https://www.nature.com/articles/nature18299","v8V058QAAAAJ",2016
"Genomic analyses inform on migration events during the peopling of Eurasia","L Pagani, DJ Lawson, E Jagoda, A Mörseburg, A Eriksson, M Mitt, F Clemente, G Hudjashov, M DeGiorgio, L Saag, JD Wall, A Cardona, R Mägi, MAW Sayres, S Kaewert, C Inchley, CL Scheib, M Järve, M Karmin, GS Jacobs, T Antao, FM Iliescu, A Kushniarevich, Q Ayub, C Tyler-Smith, Y Xue, B Yunusbayev, K Tambets, CB Mallick, L Saag, E Pocheshkhova, G Andriadze, C Muller, MC Westaway, DM Lambert, G Zoraqi, S Turdikulova, D Dalimova, Z Sabitov, GNN Sultana, J Lachance, S Tishkoff, K Momynaliev, J Isakova, LD Damba, M Gubina, P Nymadawa, I Evseeva, L Atramentova, O Utevska, Fço-X Ricaut, N Brucato, H Sudoyo, T Letellier, MP Cox, NA Barashkov, V Škaro, L Mulahasanovic, D Primorac, H Sahakyan, M Mormina, CA Eichstaedt, DV Lichman, S Abdullah, G Chaubey, JTS Wee, E Mihailov, A Karunas, S Litvinov, R Khusainova, N Ekomasova, V Akhmetova, I Khidiyatova, D Marjanović, L Yepiskoposyan, DM Behar, E Balanovska, A Metspalu, M Derenko, B Malyarchuk, M Voevoda, SA Fedorova, LP Osipova, MMón Lahr, P Gerbault, M Leavesley, AB Migliano, M Petraglia, O Balanovsky, EK Khusnutdinova, E Metspalu, MG Thomas, A Manica, R Nielsen, R Villems, E Willerslev, T Kivisild, M Metspalu","Nature","538 (7624), 238-242",504,2016,"13715589596189883679","VLnqNzywnoUC","https://www.nature.com/articles/nature19792","v8V058QAAAAJ",2016
"Estimating economic losses to tourism in Africa from the illegal killing of elephants","R Naidoo, B Fisher, A Manica, A Balmford","Nature Communications","7 (1), 13379",158,2016,"15776159432613136438","4MWp96NkSFoC","https://www.nature.com/articles/ncomms13379","v8V058QAAAAJ",2016
"Robustness despite uncertainty: regional climate data reveal the dominant role of humans in explaining global extinctions of Late Quaternary megafauna","LJ Bartlett, DR Williams, GW Prescott, A Balmford, RE Green, A Eriksson, PJ Valdes, JS Singarayer, A Manica","Ecography","39 (2), 152-161",150,2016,"10522685625118019932","ZuybSZzF8UAC","https://onlinelibrary.wiley.com/doi/abs/10.1111/ecog.01566","v8V058QAAAAJ",2016
"Comparison of carnivore, omnivore, and herbivore mammalian genomes with a new leopard assembly","S Kim, YS Cho, H-M Kim, O Chung, H Kim, S Jho, H Seomun, J Kim, WY Bang, C Kim, J An, CH Bae, Y Bhak, S Jeon, H Yoon, Y Kim, JH Jun, HJ Lee, S Cho, O Uphyrkina, A Kostyria, J Goodrich, D Miquelle, M Roelke, J Lewis, A Yurchenko, A Bankevich, J Cho, S Lee, JS Edwards, JA Weber, J Cook, S Kim, H Lee, A Manica, I Lee, SJ O’Brien, J Bhak, J-H Yeo","Genome Biology","17, 1-12",126,2016,"6490736386264268496","BwyfMAYsbu0C","https://link.springer.com/article/10.1186/s13059-016-1071-4","v8V058QAAAAJ",2016
"The genetics of an early Neolithic pastoralist from the Zagros, Iran","M Gallego-Llorente, S Connell, ER Jones, DC Merrett, Y Jeon, A Eriksson, V Siska, C Gamba, C Meiklejohn, R Beyer, S Jeon, YS Cho, M Hofreiter, J Bhak, A Manica, R Pinhasi","Scientific Reports","6 (1), 31326",96,2016,"8436351311305021945,12400922667330361916","uc_IGeMz5qoC","https://www.nature.com/articles/srep31326","v8V058QAAAAJ",2016
"Recent social conditions affect boldness repeatability in individual sticklebacks","JW Jolles, BA Taylor, A Manica","Animal Behaviour","112, 139-145",77,2016,"1346288566376808265","_Re3VWB3Y0AC","https://www.sciencedirect.com/science/article/pii/S0003347215004510","v8V058QAAAAJ",2016
"An ethnically relevant consensus Korean reference genome is a step towards personal reference genomes","YS Cho, H Kim, H-M Kim, S Jho, JH Jun, YJ Lee, KS Chae, CG Kim, S Kim, A Eriksson, JS Edwards, S Lee, BC Kim, A Manica, T-K Oh, GM Church, J Bhak","Nature Communications","7 (1), 1-13",75,2016,"17113800360840567110,10786268050710690896","vDijr-p_gm4C","https://www.nature.com/articles/ncomms13637]","v8V058QAAAAJ",2016
"Proximate drivers of spatial segregation in non-breeding albatrosses","TA Clay, A Manica, PG Ryan, JRD Silk, JP Croxall, L Ireland, RA Phillips","Scientific Reports","6 (1), 29932",75,2016,"16784199198810192793","zLWjf1WUPmwC","https://www.nature.com/articles/srep29932","v8V058QAAAAJ",2016
"Surf and turf: predation by egg-eating snakes has led to the evolution of parental care in a terrestrial lizard","DA Pike, RW Clark, A Manica, HY Tseng, JY Hsu, WS Huang","Scientific Reports","6 (1), 22207",44,2016,"5685639202887471052","35r97b3x0nAC","https://www.nature.com/articles/srep22207","v8V058QAAAAJ",2016
"Consistency in migration strategies and habitat preferences of brown skuas over two winters, a decade apart","APB Carneiro, A Manica, TA Clay, JRD Silk, M King, RA Phillips","Marine Ecology Progress Series","553, 267-281",42,2016,"11223654097567260676","EkHepimYqZsC","https://www.int-res.com/abstracts/meps/v553/p267-281/","v8V058QAAAAJ",2016
"Who directs group movement? Leader effort versus follower preference in stickleback fish of different personality","S Nakayama, JL Harcourt, RA Johnstone, A Manica","Biology Letters","12 (5), 20160207",33,2016,"10497712518974751947","9Nmd_mFXekcC","https://royalsocietypublishing.org/doi/abs/10.1098/rsbl.2016.0207","v8V058QAAAAJ",2016
"Food intake rates of inactive fish are positively linked to boldness in three‐spined sticklebacks Gasterosteus aculeatus","JW Jolles, A Manica, NJ Boogert","Journal of Fish Biology","88 (4), 1661-1668",32,2016,"8863194240309554250","ZfRJV9d4-WMC","https://onlinelibrary.wiley.com/doi/abs/10.1111/jfb.12934","v8V058QAAAAJ",2016
"Long-term changes in population size, distribution and productivity of skuas (Stercorarius spp.) at Signy Island, South Orkney Islands","APB Carneiro, A Manica, RA Phillips","Polar Biology","39, 617-625",14,2016,"13821419479610071596","UHK10RUVsp4C","https://link.springer.com/article/10.1007/s00300-015-1817-6","v8V058QAAAAJ",2016
"Evidence for conditional cooperation: a response to Schlicht et al.","RA Johnstone, A Manica, AL Fayet, MC Stoddard, MA Rodriguez-Gironés, CA Hinde","Behavioral Ecology","27 (3), e6-e7",6,2016,"4210869135119245982","z_wVstp3MssC","https://academic.oup.com/beheco/article-abstract/27/3/e6/2366239","v8V058QAAAAJ",2016
"Inability of the most commonly used forensic genetic markers to distinguish between samples belonging to different ethnicities of Pakistan with diverse genetic background","HM Chishti, A Manica, M Ansar, A Eriksson, M Ajmal, A Hameed","Forensic Science International: Genetics","22, e7-e8",3,2016,"2341709420621834226","evX43VCCuoAC","https://www.fsigenetics.com/article/S1872-4973(16)30006-0/abstract","v8V058QAAAAJ",2016
"How Levins’ dynamics emerges from a Ricker metapopulation model","F Elías-Wolff, A Eriksson, A Manica, B Mehlig","Theoretical Ecology","9, 173-183",2,2016,"10797666290228136111,16335027649180429370","PR6Y55bgFSsC","https://link.springer.com/article/10.1007/s12080-015-0271-y","v8V058QAAAAJ",2016
"Ancient genomes show social and reproductive behavior of early Upper Paleolithic foragers","M Sikora, A Seguin-Orlando, VC Sousa, A Albrechtsen, T Korneliussen, A Ko, S Rasmussen, I Dupanloup, PR Nigst, MD Bosch, G Renaud, ME Allentoft, A Margaryan, SV Vasilyev, EV Veselovskaya, SB Borutskaya, T Deviese, D Comeskey, T Higham, A Manica, R Foley, DJ Meltzer, R Nielsen, L Excoffier, MM Lahr, L Orlando, E Willerslev","Science","358 (6363), 659-662",364,2017,"3078229122971179514","-FonjvnnhkoC","https://www.science.org/doi/abs/10.1126/science.aao1807","v8V058QAAAAJ",2017
"Consistent individual differences drive collective behavior and group functioning of schooling fish","JW Jolles, NJ Boogert, VH Sridhar, ID Couzin, A Manica","Current Biology","27 (18), 2862-2868. e7",357,2017,"11700657102262725627,6758233696187562598","b1wdh0AR-JQC","https://www.cell.com/current-biology/fulltext/S0960-9822(17)31013-8","v8V058QAAAAJ",2017
"The Neolithic transition in the Baltic was not driven by admixture with early European farmers","ER Jones, G Zarina, V Moiseyev, E Lightfoot, PR Nigst, A Manica, R Pinhasi, DG Bradley","Current Biology","27 (4), 576-582",197,2017,"6430917577083159466","EYYDruWGBe4C","https://www.cell.com/current-biology/fulltext/S0960-9822(16)31542-1","v8V058QAAAAJ",2017
"Paleogenomic evidence for multi-generational mixing between Neolithic farmers and Mesolithic hunter-gatherers in the Lower Danube Basin","G González-Fortes, ER Jones, E Lightfoot, C Bonsall, C Lazar, A Grandal-d’Anglade, MíaD Garralda, L Drak, V Siska, A Simalcsik, A Boroneanţ, JRónV Romaní, MV Rodríguez, P Arias, R Pinhasi, A Manica, M Hofreiter","Current Biology","27 (12), 1801-1810. e10",170,2017,"3064255892174826635","lmc2jWPfTJgC","https://www.cell.com/current-biology/fulltext/S0960-9822(17)30559-6?elsca1=etoc&elsca2=email&elsca3=0960-9822_20170619_27_12_&elsca4=Cell+Press","v8V058QAAAAJ",2017
"Genome-wide data from two early Neolithic East Asian individuals dating to 7700 years ago","V Siska, ER Jones, S Jeon, Y Bhak, H-M Kim, YS Cho, H Kim, K Lee, E Veselovskaya, T Balueva, M Gallego-Llorente, M Hofreiter, DG Bradley, A Eriksson, R Pinhasi, J Bhak, A Manica","Science Advances","3 (2), e1601877",132,2017,"11075784544879676604","ILKRHgRFtOwC","https://www.science.org/doi/abs/10.1126/sciadv.1601877","v8V058QAAAAJ",2017
"Land‐use strategies to balance livestock production, biodiversity conservation and carbon storage in Yucatán, Mexico","DR Williams, F Alvarado, RE Green, A Manica, B Phalan, A Balmford","Global Change Biology","23 (12), 5260-5272",85,2017,"4330850844438675508","k8Z6L05lTy4C","https://onlinelibrary.wiley.com/doi/abs/10.1111/gcb.13791","v8V058QAAAAJ",2017
"Inferring allele frequency trajectories from ancient DNA indicates that selection on a chicken gene coincided with changes in medieval husbandry practices","L Loog, MG Thomas, R Barnett, R Allen, N Sykes, PD Paxinos, Oél Lebrasseur, K Dobney, J Peters, A Manica, G Larson, A Eriksson","Molecular Biology and Evolution","34 (8), 1981-1990",82,2017,"10000859980355471485","gsN89kCJA0AC","https://academic.oup.com/mbe/article-abstract/34/8/1981/3746559","v8V058QAAAAJ",2017
"Infections on the move: how transient phases of host movement influence disease spread","DR Daversa, A Fenton, AI Dell, TWJ Garner, A Manica","Proceedings of the Royal Society B: Biological Sciences","284 (1869), 20171807",68,2017,"17614873816150625849","PoWvk5oyLR8C","https://royalsocietypublishing.org/doi/abs/10.1098/rspb.2017.1807","v8V058QAAAAJ",2017
"Methods for detecting and quantifying individual specialisation in movement and foraging strategies of marine predators","APB Carneiro, AS Bonnet-Lebrun, A Manica, IJ Staniland, RA Phillips","Marine Ecology Progress Series","578, 151-166",47,2017,"258321547431275812","WZBGuue-350C","https://www.int-res.com/abstracts/meps/v578/p151-166/","v8V058QAAAAJ",2017
"Turn-taking in cooperative offspring care: by-product of individual provisioning behavior or active response rule?","JL Savage, LE Browning, A Manica, AF Russell, RA Johnstone","Behavioral Ecology and Sociobiology","71, 1-10",46,2017,"1454252666743348452","S16KYo8Pm5AC","https://link.springer.com/article/10.1007/s00265-017-2391-4","v8V058QAAAAJ",2017
"Escaping the oligotrophic gyre? The year-round movements, foraging behaviour and habitat preferences of Murphy’s petrels","TA Clay, RA Phillips, A Manica, HA Jackson, ML Brooke","Marine Ecology Progress Series","579, 139-155",45,2017,"9031613129325310790","M7yex6snE4oC","https://www.int-res.com/abstracts/meps/v579/p139-155/","v8V058QAAAAJ",2017
"Estimating mobility using sparse data: Application to human genetic variation","L Loog, M Mirazón Lahr, M Kovacevic, A Manica, A Eriksson, MG Thomas","Proceedings of the National Academy of Sciences","114 (46), 12213-12218",44,2017,"8033407788907260936","i2xiXl-TujoC","https://www.pnas.org/doi/abs/10.1073/pnas.1703642114","v8V058QAAAAJ",2017
"An earlier revolution: genetic and genomic analyses reveal pre-existing cultural differences leading to Neolithization","M Leonardi, G Barbujani, A Manica","Scientific Reports","7 (1), 3525",10,2017,"12921721953654352806,5820361849204795777,17277228154587140561","VaXvl8Fpj5cC","https://www.nature.com/articles/s41598-017-03717-6","v8V058QAAAAJ",2017
"Empirical phylogenies and species abundance distributions are consistent with preequilibrium dynamics of neutral community models with gene flow","AS Bonnet-Lebrun, A Manica, A Eriksson, ASL Rodrigues","Evolution","71 (5), 1149-1163",2,2017,"4396311090298733558,891578359078852783","KUbvn5osdkgC","https://academic.oup.com/evolut/article-abstract/71/5/1149/6881975","v8V058QAAAAJ",2017
"Individual variability in seabird foraging and migration","RA Phillips, S Lewis, J González-Solís, F Daunt, APB Carneiro, AS Bonnet-Lebrun, A Manica, IJ Staniland, MI Bogdanova, A Butler, S Wanless, B Moe, T Anker-Nilssen, M Frederiksen, T Boulinier, LS Chivers, S Christensen-Dalsgaard, S Descamps, MP Harris, M Newell, B Olsen, D Shaw, H Steen, H Strøm, TL Thórarinsson, ECM Camprasse, Y Cherel, JPY Arnould, AJ Hoskins, P Bustamante, CA Bost, Rv Bemmelen, B Moe, SA Hanssen, NM Schmidt, J Hansen, J Lang, B Sittler, L Bollache, I Tulp, R Klaassen, O Gilg, J Krietsch, S Hahn, M Kopp, HU Peter, S Lisovski","Marine Ecology Progress Series","578, 115-261",2,2017,"10467997060385404775","5qfkUJPXOUwC","https://www.int-res.com/articles/theme/m578_ThemeSection.pdf","v8V058QAAAAJ",2017
"Modern Variation in the Shape of the Birth Canal and the Effects of Climate and Population History","L Betti, A Manica","American Journal of Physical Anthropology","162, 121-121",1,2017,"8145961878723339511","q3CdL3IzO_QC","https://scholar.google.com/scholar?cluster=8145961878723339511&hl=en&oi=scholarr","v8V058QAAAAJ",2017
"Corrigendum: An ethnically relevant consensus Korean reference genome is a step towards personal reference genomes","YS Cho, H Kim, H-M Kim, S Jho, JH Jun, YJ Lee, KS Chae, CG Kim, S Kim, A Eriksson, JS Edwards, S Lee, BC Kim, A Manica, T-K Oh, GM Church, J Bhak","Nature Communications","8",1,2017,"1911675760977859266","e_rmSamDkqQC","https://www.ncbi.nlm.nih.gov/pmc/articles/PMC5635174/","v8V058QAAAAJ",2017
"Did our species evolve in subdivided populations across Africa, and why does it matter?","EML Scerri, MG Thomas, A Manica, P Gunz, JT Stock, C Stringer, M Grove, HS Groucutt, A Timmermann, GP Rightmire, F d’Errico, CA Tryon, NA Drake, AS Brooks, RW Dennell, R Durbin, BM Henn, J Lee-Thorp, P Demenocal, MD Petraglia, JC Thompson, A Scally, Lès Chikhi","Trends in Ecology & Evolution","33 (8), 582-594",470,2018,"10089787665070398616","kh2fBNsKQNwC","https://www.cell.com/trends/ecology-evolution/fulltext/S0169-5347(18)30117-4?&","v8V058QAAAAJ",2018
"Ancient goat genomes reveal mosaic domestication in the Fertile Crescent","KG Daly, PM Delser, VE Mullin, A Scheu, V Mattiangeli, MD Teasdale, AJ Hare, J Burger, MP Verdugo, MJ Collins, R Kehati, CM Erek, G Bar-Oz, Fço Pompanon, T Cumer, C Çakırlar, AF Mohaseb, D Decruyenaere, H Davoudi, Öz Çevik, G Rollefson, J-D Vigne, R Khazaeli, H Fathi, SB Doost, RR Sorkhani, AA Vahdati, EW Sauer, HA Kharanaghi, S Maziar, B Gasparian, R Pinhasi, L Martin, D Orton, BS Arbuckle, N Benecke, A Manica, LK Horwitz, M Mashkour, DG Bradley","Science","361 (6397), 85-88",208,2018,"16712253454723167825","Ri6SYOTghG4C","https://www.science.org/doi/abs/10.1126/science.aas9411","v8V058QAAAAJ",2018
"Ancient human parallel lineages within North America contributed to a coastal expansion","CL Scheib, H Li, T Desai, V Link, C Kendall, G Dewar, PW Griffith, A Mörseburg, JR Johnson, A Potter, SL Kerr, P Endicott, J Lindo, M Haber, Y Xue, C Tyler-Smith, MS Sandhu, JG Lorenz, TD Randall, Z Faltyskova, L Pagani, P Danecek, TC O’Connell, P Martz, AS Boraas, BF Byrd, A Leventhal, R Cambra, R Williamson, L Lesage, B Holguin, EY-D Soto, JT Rosas, M Metspalu, JT Stock, A Manica, A Scally, D Wegmann, RS Malhi, T Kivisild","Science","360 (6392), 1024-1027",145,2018,"9542516662560318630","hCrLmN-GePgC","https://www.science.org/doi/abs/10.1126/science.aar6851","v8V058QAAAAJ",2018
"Human variation in the shape of the birth canal is significant and geographically structured","L Betti, A Manica","Proceedings of the Royal Society B","285 (1889), 20181807",120,2018,"3136645703596089788","sNmaIFBj_lkC","https://royalsocietypublishing.org/doi/abs/10.1098/rspb.2018.1807","v8V058QAAAAJ",2018
"Energy efficiency drives the global seasonal distribution of birds","M Somveille, ASL Rodrigues, A Manica","Nature Ecology & Evolution","2 (6), 962-969",91,2018,"1115240796911487452","FPJr55Dyh1AC","https://www.nature.com/articles/s41559-018-0556-9","v8V058QAAAAJ",2018
"A genomic Neolithic time transect of hunter-farmer admixture in central Poland","DM Fernandes, D Strapagiel, P Borówka, Błaże Marciniak, Eżb Żądzińska, K Sirak, V Siska, R Grygiel, J Carlsson, A Manica, Wła Lorkiewicz, R Pinhasi","Scientific Reports","8 (1), 14879",77,2018,"6526308868572806146","0izLItjtcgwC","https://www.nature.com/articles/s41598-018-33067-w","v8V058QAAAAJ",2018
"Repeatable group differences in the collective behaviour of stickleback shoals across ecological contexts","JW Jolles, KL Laskowski, NJ Boogert, A Manica","Proceedings of the Royal Society B: Biological Sciences","285 (1872), 20172629",72,2018,"5513760481464832291","foquWX3nUaYC","https://royalsocietypublishing.org/doi/abs/10.1098/rspb.2017.2629","v8V058QAAAAJ",2018
"Routine habitat switching alters the likelihood and persistence of infection with a pathogenic parasite","DR Daversa, A Manica, J Bosch, JW Jolles, TWJ Garner","Functional Ecology","32 (5), 1262-1270",50,2018,"8420980645430077273,972867462527632756","Dip1O2bNi0gC","https://besjournals.onlinelibrary.wiley.com/doi/abs/10.1111/1365-2435.13038","v8V058QAAAAJ",2018
"Larval swimming capacities affect genetic differentiation and range size in demersal marine fishes","GB Nanninga, A Manica","Marine Ecology Progress Series","589, 1-12",43,2018,"3247949321260547063","ruyezt5ZtCIC","https://www.int-res.com/abstracts/meps/v589/p1-12/","v8V058QAAAAJ",2018
"Age‐related variation in non‐breeding foraging behaviour and carry‐over effects on fitness in an extremely long‐lived bird","TA Clay, EJ Pearmain, RAR McGill, A Manica, RA Phillips","Functional Ecology","32 (7), 1832-1846",40,2018,"9488450151303223045","0N-VGjzr574C","https://besjournals.onlinelibrary.wiley.com/doi/abs/10.1111/1365-2435.13120","v8V058QAAAAJ",2018
"Carnivore abundance near motorways related to prey and roadkills","A Planillo, C Mata, A Manica, JE Malo","The Journal of Wildlife Management","82 (2), 319-327",38,2018,"8039281651174842009","SpbeaW3--B0C","https://wildlife.onlinelibrary.wiley.com/doi/abs/10.1002/jwmg.21384","v8V058QAAAAJ",2018
"Late Quaternary horses in Eurasia in the face of climate and vegetation change","M Leonardi, F Boschin, K Giampoudakis, RM Beyer, M Krapp, R Bendrey, R Sommer, P Boscato, A Manica, D Nogues-Bravo, L Orlando","Science Advances","4 (7), eaar5589",34,2018,"16166537486440104083","9pM33mqn1YgC","https://www.science.org/doi/abs/10.1126/sciadv.aar5589","v8V058QAAAAJ",2018
"Quantifying individual specialization using tracking data: a case study on two species of albatrosses","AS Bonnet-Lebrun, RA Phillips, A Manica, ASL Rodrigues","Marine Biology","165 (10), 152",24,2018,"10970725228656395078","LO7wyVUgiFcC","https://link.springer.com/article/10.1007/s00227-018-3408-x","v8V058QAAAAJ",2018
"Global demographic history of human populations inferred from whole mitochondrial genomes","EF Miller, A Manica, W Amos","Royal Society Open Science","5 (8), 180543",17,2018,"4743834780424778744","GtLg2Ama23sC","https://royalsocietypublishing.org/doi/abs/10.1098/rsos.180543","v8V058QAAAAJ",2018
"A metapopulation model of the spread of the Devil Facial Tumour Disease predicts the long term collapse of its host but not its extinction","V Siska, A Eriksson, B Mehlig, A Manica","arXiv preprint arXiv:",":1806.05449",16,2018,"2658541170858380884","_axFR9aDTf0C","https://arxiv.org/abs/1806.05449","v8V058QAAAAJ",2018
"The development of social interactions in Corydoras aeneus larvae","RJ Riley, T Roe, ER Gillie, NJ Boogert, A Manica","bioRxiv","455188",0,2018,NA,"6ZxmRoH8BuwC","https://www.biorxiv.org/content/10.1101/455188.abstract","v8V058QAAAAJ",2018
"The ancient origin of some modern Asian populations revealed by ancient DNA","A Manica, V Siska","The Science Breaker","",0,2018,NA,"NyGDZy8z5eUC","https://www.researchgate.net/profile/Andrea-Manica/publication/324749515_The_ancient_origin_of_some_modern_Asian_populations_revealed_by_ancient_DNA/links/5b6cd39292851ca65053e3e8/The-ancient-origin-of-some-modern-Asian-populations-revealed-by-ancient-DNA.pdf","v8V058QAAAAJ",2018
"A linear regression model to reconstruct the climate of the last 800,000 years","M Krapp, SL Edmundson, A Manica","EGU General Assembly Conference Abstracts","11004",0,2018,NA,"_FM0Bhl9EiAC","https://ui.adsabs.harvard.edu/abs/2018EGUGA..2011004K/abstract","v8V058QAAAAJ",2018
"A global-level assessment of the effectiveness of protected areas at resisting anthropogenic pressures","J Geldmann, A Manica, ND Burgess, L Coad, A Balmford","Proceedings of the National Academy of Sciences","116 (46), 23209-23215",629,2019,"8411235999947384354,11636802120177180100","2tRrZ1ZAMYUC","https://www.pnas.org/doi/abs/10.1073/pnas.1908221116","v8V058QAAAAJ",2019
"The configuration of Northern Hemisphere ice sheets through the Quaternary","CL Batchelor, M Margold, M Krapp, DK Murton, AS Dalton, PL Gibbard, CR Stokes, JB Murton, A Manica","Nature Communications","10 (1), 3713",501,2019,"302858036428931687","Bg7qf7VwUHIC","https://www.nature.com/articles/s41467-019-11601-2","v8V058QAAAAJ",2019
"Parallel adaptation of rabbit populations to myxoma virus","JM Alves, M Carneiro, JY Cheng, ALd Matos, MM Rahman, L Loog, PF Campos, N Wales, A Eriksson, A Manica, T Strive, SC Graham, S Afonso, DJ Bell, L Belmont, JP Day, SJ Fuller, Sép Marchandeau, WJ Palmer, G Queney, AK Surridge, FG Vieira, G McFadden, R Nielsen, MTP Gilbert, PJ Esteves, N Ferrand, FM Jiggins","Science","363 (6433), 1319-1326",167,2019,"3537912893909427244","GFxP56DSvIMC","https://www.science.org/doi/abs/10.1126/science.aau7285","v8V058QAAAAJ",2019
"Fast and accurate relatedness estimation from high-throughput sequencing data in the presence of inbreeding","K Hanghøj, I Moltke, PA Andersen, A Manica, TS Korneliussen","GigaScience","8 (5), giz034",146,2019,"15949452647612285184","nVrZBo8bIpAC","https://academic.oup.com/gigascience/article-abstract/8/5/giz034/5481763","v8V058QAAAAJ",2019
"Where the wild birds go: explaining the differences in migratory destinations across terrestrial bird species","M Somveille, A Manica, ASL Rodrigues","Ecography","42 (2), 225-236",73,2019,"9917255252171961003","rmuvC79q63oC","https://nsojournals.onlinelibrary.wiley.com/doi/abs/10.1111/ecog.03531","v8V058QAAAAJ",2019
"A western route of prehistoric human migration from Africa into the Iberian Peninsula","G González-Fortes, F Tassi, E Trucchi, K Henneberger, JLA Paijmans, D Díez-del-Molino, H Schroeder, RR Susca, C Barroso-Ruíz, FJ Bermúdez, C Barroso-Medina, AMS Bettencourt, HA Sampaio, A Grandal-d'Anglade, A Salas, Ad Lombera-Hermida, RónFáb Valcarce, M Vaquero, S Alonso, M Lozano, XéP Rodríguez-Alvarez, C Fernández-Rodríguez, A Manica, M Hofreiter, G Barbujani","Proceedings of the Royal Society B: Biological Sciences","286 (1895), 20182288",62,2019,"17999023273980559413","KbBQZpvPDL4C","https://royalsocietypublishing.org/doi/abs/10.1098/rspb.2018.2288","v8V058QAAAAJ",2019
"The genome of the giant Nomura’s jellyfish sheds light on the early evolution of active predation","H-M Kim, JA Weber, N Lee, SG Park, YS Cho, Y Bhak, N Lee, Y Jeon, S Jeon, V Luria, A Karger, MW Kirschner, YJ Jo, S Woo, K Shin, O Chung, J-C Ryu, H-S Yim, J-H Lee, JS Edwards, A Manica, J Bhak, S Yum","BMC Biology","17, 1-12",55,2019,"1383554803270502504,7886394309959812313","5MTHONV0fEkC","https://link.springer.com/article/10.1186/s12915-019-0643-7","v8V058QAAAAJ",2019
"A systematic comparison of bias correction methods for paleoclimate simulations","R Beyer, M Krapp, A Manica","Clim. Past Discuss","11, 1-23",31,2019,"2246445832936511188","_OXeSy2IsFwC","https://pdfs.semanticscholar.org/efbe/f94711612d2cfc4943c6b6e9306210e0909d.pdf","v8V058QAAAAJ",2019
"Chromosome-scale assembly comparison of the Korean Reference Genome KOREF from PromethION and PacBio with Hi-C mapping information","H-S Kim, S Jeon, C Kim, YK Kim, YS Cho, J Kim, A Blazyte, A Manica, S Lee, J Bhak","GigaScience","8 (12), giz125",22,2019,"9501035206107163708","BJbdYPG6LGMC","https://academic.oup.com/gigascience/article-abstract/8/12/giz125/5651108","v8V058QAAAAJ",2019
